{
  "$schema": "https://json-schema.org/draft/2020-12/schema",
  "$id": "mecanifica.hipergrafo-capacidades@1",
  "type": "object",
  "required": [
    "formato",
    "assinatura",
    "nos",
    "hiperarestas"
  ],
  "additionalProperties": false,
  "properties": {
    "formato": {
      "const": "mecanifica.hipergrafo-capacidades@1"
    },
    "assinatura": {
      "type": "string"
    },
    "nos": {
      "type": "array"
    },
    "hiperarestas": {
      "type": "array"
    }
  }
}
